{"schemaVersion":1,"kind":"assessment","lessonId":"LES-0058","masteryBoundary":"requires-reviewed-learner-evidence","lastReviewed":"2026-08-05","reviewAfter":"2027-02-05","id":"ASM-0158","type":"production","difficulty":"expert","prompt":"Design the distributed state layer for a global inventory reservation service. A customer must not receive two confirmed reservations for the last unit, regional browsing should remain fast, region isolation must have an explicit behavior, operators need safe leader and membership recovery, and the team must explain latency, availability, cost and disaster trade-offs.","directAnswer":"Begin with operations and invariants, not a database label. Separate browse availability from reservation correctness. Product browsing can use asynchronous regional projections with an explicit freshness objective and visible uncertainty. The last-unit reservation is a conditional state transition on an authoritative inventory key; it needs a single serialization order, stable operation identity and a response whose acknowledgement meaning is precise. Partition inventory by a stable product or stock-unit owner so unrelated keys progress independently, while hotspot handling preserves that key's invariant. Replicate each authoritative partition with an odd voter set placed across failure domains; define quorum, leader, commit, apply and client-routing behavior. During a partition, a component without quorum rejects or queues correctness-critical reservations rather than confirming unprovable stock. If the business chooses a bounded oversell mode, model it as an explicit escrow or allocation invariant with reconciliation, not an accidental stale write. State a consistency model for every API: for example linearizable reservation transitions, monotonic or read-your-writes session behavior for confirmation views, and bounded-stale browsing. Normal-operation latency includes client-to-leader, quorum persistence, execution and response; multi-region voters trade wider failure tolerance for larger tail latency and transfer cost. Use consensus for the small authoritative decision log, not every cache or analytic projection. Membership changes must preserve overlapping quorums and be automated with backup and restore boundaries. Leader leases may optimize reads only when the implementation's clock and quorum assumptions are met; external allocation or fulfillment writers need monotonically increasing fencing tokens validated by the target. Observe terms, leaders, commit and applied indexes, quorum reachability, replication lag, election rate, request correctness and latency, stale-read age, rejected fencing generations, queue age, repair progress and user outcomes. Test delayed/lost/duplicated messages, leader crash, follower lag, majority loss, disk full, clock disturbance, rolling change and restore in a disposable representative environment. Recovery proves committed history, reconciles ambiguous reservations, repairs replicas through supported snapshots or log catch-up, validates business counts, and measures RPO/RTO. Protect identities and transport, minimize inventory/customer data in logs, authorize membership and force operations, separate runtime from recovery privileges, and audit every override. Cost includes voters, cross-zone/region traffic, storage amplification, snapshots, repair headroom, observability and operator complexity.","foundation":"Distributed design assigns a specific consistency and availability contract to each business operation. Replication improves survivability only when agreement, placement, client routing, repair and external-effect boundaries preserve the invariant.","reasoningSteps":["Define operations, invariants and acknowledgement meanings.","Separate authoritative reservation from regional browse projections.","Choose partition key and hotspot policy.","Choose consistency/session model per read and write.","Design voters, placement, quorum and leader path.","Define partition, quorum-loss and degraded behavior.","Calculate latency, throughput, storage and network envelopes.","Design leases, fencing, idempotency and external effects.","Design membership, repair, backup, restore and reconciliation.","Integrate security, observability, drills, cost and ownership."],"seniorAnswer":"I would present a table of operations and guarantees, then walk one reservation through leader, quorum commit, apply, acknowledgement and projection. I would show exactly which regional requests stop under isolation and why, rather than calling the whole service CP or AP. I would also prove how a stale leader is fenced from fulfillment and how ambiguous confirmations are reconciled.","weakAnswer":"Use five replicas in every region with eventual consistency for speed and a distributed lock for the last item.","whyWeak":"It does not define who owns the item, how a lock survives partitions, what five replicas mean, which acknowledgement is safe, how regional writes converge without oversell, or what latency and cost result.","evidence":[{"signal":"operation-to-guarantee and state-ownership table","proves":"explicit intended contract","doesNotProve":"implementation satisfies it"},{"signal":"quorum placement and failure matrix","proves":"modeled tolerance and unavailable cases","doesNotProve":"real correlated failures"},{"signal":"history-based consistency and fencing tests","proves":"sampled safety under tested faults","doesNotProve":"all executions"},{"signal":"load, lag, repair and restore evidence","proves":"sampled performance and recovery envelope","doesNotProve":"unmodeled scale"},{"signal":"business reconciliation","proves":"sampled inventory correctness","doesNotProve":"every customer journey"}],"followUps":[{"prompt":"Why not put a voter in every major region?","answer":"More distant voters can increase commit tail latency, failure interactions, transfer cost and operational complexity. Choose voter placement from required failure tolerance and latency; use non-voting projections where appropriate."},{"prompt":"Can R plus W greater than N alone guarantee linearizability?","answer":"Intersection is necessary in quorum-register designs but not sufficient by itself. Version choice, concurrent writes, failure handling, real-time order, durability and implementation protocol also matter."},{"prompt":"What happens when a majority is lost?","answer":"Correctness-critical progress stops or follows a separately designed escrow rule. The system should expose quorum loss, preserve state, reject unsafe force operations and execute a reviewed recovery path."},{"prompt":"How do you handle a single hot product?","answer":"Measure the invariant's serialization demand. Cache browsing, coalesce reads, queue bounded reservation attempts, shed excess and consider escrowed allocation; arbitrary repartitioning cannot remove coordination for one last-unit invariant."}],"rubric":[{"criterion":"Business operations and invariants","points":10,"observableEvidence":"Browse reserve confirm cancel acknowledgement"},{"criterion":"State ownership and partitioning","points":10,"observableEvidence":"Authoritative key projections hotspot handling"},{"criterion":"Consistency contracts","points":10,"observableEvidence":"Linearizable session bounded-stale semantics"},{"criterion":"Replication and quorum","points":10,"observableEvidence":"Voters placement intersection commit apply"},{"criterion":"Partition behavior","points":10,"observableEvidence":"Majority minority degraded and escrow decisions"},{"criterion":"Time leader and fencing","points":10,"observableEvidence":"Lease assumptions epochs downstream rejection"},{"criterion":"Capacity latency and cost","points":10,"observableEvidence":"Tail path throughput storage network headroom"},{"criterion":"Operations and recovery","points":10,"observableEvidence":"Membership repair backup restore reconciliation"},{"criterion":"Security and observability","points":10,"observableEvidence":"Identity transport privileges audit signals"},{"criterion":"Validation and communication","points":10,"observableEvidence":"Fault history business tests trade-off explanation"}],"maximumScore":100}
