{"schemaVersion":1,"kind":"assessment","id":"ASM-0121","lessonId":"LES-0046","type":"diagnostic","difficulty":"advanced","prompt":"A Helm render succeeds, but the API rejects one Deployment and no new Pod appears. Diagnose the first failed boundary and define the safe repair path.","directAnswer":"Bind cluster, namespace, release identity, source commit, chart/dependency and renderer versions, ordered values and render digest. A successful client render proves only template evaluation. Capture the server dry-run or API error, including API group/version/kind/name, field path, admission policy and audit ID. Classify schema/discovery, authorization, admission or immutable-field rejection. Repair the smallest source input/template or planned migration; do not bypass admission or repeatedly upgrade. Re-render deterministically, repeat schema/policy/server validation, review the normalized diff, perform one bounded release, observe generation/conditions, then verify the user operation.","foundation":"Client rendering and API acceptance are different gates.","reasoningSteps":["Bind environment and release identity.","Freeze exact source and inputs.","Capture first server rejection.","Classify schema, authorization, admission or immutable field.","Repair authoritative source.","Repeat validation ladder.","Review diff and bounded rollout.","Verify user journey and cleanup."],"seniorAnswer":"I do not treat more templating as a server fix. I preserve the exact proposal and API decision, correct the source at the earliest failed boundary, then prove the entire chain through the user operation.","weakAnswer":"Run helm upgrade again with force.","whyWeak":"Force or retry can replace resources, repeat hooks and enlarge impact without correcting the rejection.","evidence":[{"signal":"helm template exit zero","proves":"client template rendered","doesNotProve":"server acceptance"},{"signal":"server dry-run denial with field/policy","proves":"current API rejected exact proposal","doesNotProve":"rollout"},{"signal":"generation, endpoints and journey recover","proves":"selected reconciliation and user behavior","doesNotProve":"all traffic"}],"followUps":[{"prompt":"Why save a render digest?","answer":"It binds later validation and incident evidence to the exact proposed bytes."},{"prompt":"When might --force be dangerous?","answer":"Replacement can change identity, availability and data/resource lifecycle; it is not a generic retry flag."},{"prompt":"What comes after rollout status?","answer":"Service endpoints, dependencies and the original user-level operation or SLI."}],"rubric":[{"criterion":"Boundary","points":10,"observableEvidence":"Separates render and API."},{"criterion":"Identity","points":10,"observableEvidence":"Binds source inputs object."},{"criterion":"Diagnosis","points":10,"observableEvidence":"Uses exact server evidence."},{"criterion":"Safe repair","points":10,"observableEvidence":"Changes authoritative source."},{"criterion":"Verification","points":10,"observableEvidence":"Diff rollout user cleanup."}],"maximumScore":50,"masteryBoundary":"requires-reviewed-learner-evidence","lastReviewed":"2026-08-04","reviewAfter":"2027-02-04"}
