{"schemaVersion":1,"kind":"assessment","lessonId":"LES-0054","masteryBoundary":"requires-reviewed-learner-evidence","lastReviewed":"2026-08-05","reviewAfter":"2027-02-05","id":"ASM-0147","type":"independent-transfer","difficulty":"expert","prompt":"Review an unseen Azure workload from tenant governance through recovery and cost, then adapt after a reviewer changes one major constraint without using an Azure subscription.","deliverables":["Operation data demand SLI SLO RPO and RTO contract.","Tenant management-group subscription resource-group and ownership map.","Human/workload identity RBAC Policy and data-authorization map.","Regional DNS frontend VNet compute data and return path.","VMSS AKS managed-runtime and Functions comparison.","Immutable artifact plan rollout and rollback contract.","Storage SQL Key Vault retention backup and restore design.","Burst zone-loss quota SKU IP connection and dependency model.","Monitor SLI alert incident and recovery design.","Cost model rejected alternative uncertainties and cleanup."],"evidenceRequirements":["Reviewer supplies unseen requirements and changes Region recovery traffic residency team skill or budget.","No tenant credential subscription Azure CLI PowerShell SDK API provider terraform apply portal change or public endpoint.","Sanitized pre-generated plan only; it is not deployment evidence.","Every diagram labels scope state failure trust and operating owner.","Capacity includes peak zone loss delay quota SKU IP and dependencies.","Broad Owner public-data and unjustified AKS options are rejected.","Recovery states point restore order validation achieved RPO/RTO and failback.","Reviewer observes changed-constraint reasoning delayed recall and cleanup."],"reviewPolicy":"reviewer-only-no-model-answer","rubric":[{"criterion":"Contract","points":10,"observableEvidence":"Operation data objectives"},{"criterion":"Scope governance","points":10,"observableEvidence":"Hierarchy Policy owner"},{"criterion":"Identity authorization","points":10,"observableEvidence":"Principal role scope data"},{"criterion":"Path","points":10,"observableEvidence":"DNS network compute data"},{"criterion":"Compute delivery","points":10,"observableEvidence":"Trade-off artifact rollout"},{"criterion":"Data security","points":10,"observableEvidence":"Redundancy key retention"},{"criterion":"Recovery","points":10,"observableEvidence":"Restore objectives failback"},{"criterion":"Capacity","points":10,"observableEvidence":"Burst zone quota dependencies"},{"criterion":"Observability incident","points":10,"observableEvidence":"SLI correlation response"},{"criterion":"Cost transfer","points":10,"observableEvidence":"Meters changed constraint cleanup"}],"maximumScore":100}
