{"schemaVersion":1,"kind":"assessment","lessonId":"LES-0064","masteryBoundary":"requires-reviewed-learner-evidence","lastReviewed":"2026-08-05","reviewAfter":"2027-02-05","id":"ASM-0175","type":"diagnostic","difficulty":"advanced","prompt":"A daily ML workflow is green. Its required transform failed on try 1 after writing a candidate partition; a cleanup leaf with an all-done trigger succeeded. An operator cleared the transform, try 2 appended another partition, and model version 42 was registered. The champion alias moved to version 42, but the deployment dashboard still shows the previous revision. Customers now receive stale predictions. Diagnose, contain, recover and prevent recurrence.","directAnswer":"Treat the green DAG, registered version, alias and deployment as four separate states. Stop further clears, backfills, publications, alias changes and traffic expansion. Preserve the exact DAG/run/data interval/bundle, complete task graph and trigger rules, transform attempts, stable output operation key and candidate/committed partition identities, model training/evaluation lineage, version-42 artifact digest/signature, alias audit event, deployment revision and sampled prediction/feature identities. The cleanup leaf made the run's terminal state represent cleanup rather than the required transform, so green is false evidence. Try 1 may have committed despite its task failure; try 2 appended because the sink contract was not idempotent. Reconcile both partitions by stable business keys and the intended interval, quarantine duplicate or ambiguous outputs, and publish one corrected immutable output through a supported atomic/upsert process. Invalidate version 42 as a promotion candidate until training inputs and evaluation are re-run from the reconciled version. Restore the alias to the last approved immutable version if policy uses it, but also explicitly reconcile deployment routing to the previous verified revision and prove request-level model digest, feature version, latency/errors and stale-result recovery. Redesign the DAG with partition-bound tasks, a stable idempotency key, reconcile-before-retry, bounded retries/deadline and a required terminal validator whose failure cannot be hidden by cleanup. Make registration and promotion require complete lineage, representative evaluation, thresholds, approval, immutable digest and deployment acknowledgement; alert on alias/deployment divergence.","foundation":"A DAG run summarizes task-state rules; it does not prove external effects. A retry is another attempt of one logical operation and must converge. Registration, alias assignment and deployment reconciliation are different authority boundaries.","reasoningSteps":["Freeze repeated mutations and traffic expansion.","Bind user impact to run, attempts, output, model, alias and deployment identities.","Identify false green from leaf/trigger semantics.","Reconcile unknown/duplicate output effects before retry.","Publish one correct interval output.","Invalidate and rebuild candidate evidence from reconciled data.","Restore and reconcile a known-good deployment revision.","Prove request-level recovery and consumer freshness.","Repair idempotency, terminal-state and promotion contracts.","Add divergence alerts, tests and audit."],"seniorAnswer":"I do not clear the task again. I freeze mutation and connect the stale prediction to its actual deployment/model/feature identity. The DAG is false green because cleanup represented terminal success; try 1 had an ambiguous external commit and try 2 appended, so I reconcile the interval by the stable operation key before publishing one correct version. Version 42 loses promotion eligibility. I restore and prove the last verified deployment, then fix idempotent output, required terminal validation and an evidence-gated promotion/deployment handshake.","weakAnswer":"Because the DAG is green and version 42 is champion, restart the deployment so it loads 42, then delete the first partition.","whyWeak":"It trusts two mutable summaries, may deploy a model trained from duplicate data, deletes evidence without classifying the first commit and ignores that alias movement did not prove deployment reconciliation.","evidence":[{"signal":"DAG run task graph trigger rules and attempts","proves":"recorded control flow and false-green mechanism","doesNotProve":"external commit state"},{"signal":"operation key and partition commit records","proves":"candidate/committed effects for the interval","doesNotProve":"model quality"},{"signal":"experiment and version-42 lineage","proves":"recorded training inputs and artifact identity","doesNotProve":"inputs were correct"},{"signal":"alias audit and deployment revision","proves":"registry intent and actual serving configuration are distinct","doesNotProve":"sampled requests"},{"signal":"prediction model/feature identity and consumer reconciliation","proves":"sampled serving and recovery","doesNotProve":"future quality"}],"followUps":[{"prompt":"What if try 1 wrote bytes but no commit record?","answer":"Treat them as candidates, not authoritative output. Preserve them, resolve destination authority, and remove only after proving no committed/reference/in-flight owner and satisfying retention policy."},{"prompt":"Why is moving the alias back insufficient?","answer":"The deployment may pin a version or reconcile asynchronously. Verify and change actual routing/deployment revision, then inspect request-level version evidence."},{"prompt":"How would you test the DAG repair?","answer":"Exercise upstream failure, skip, cleanup, lost acknowledgement and retry branches; assert run failure until required output validation passes and assert one logical partition/effect."}],"rubric":[{"criterion":"Containment","points":10,"observableEvidence":"Further task/output/alias/traffic mutation stopped"},{"criterion":"Cross-plane identity","points":10,"observableEvidence":"Run attempts output model alias deployment and prediction linked"},{"criterion":"Effect reconciliation","points":10,"observableEvidence":"Ambiguous and duplicate partitions safely classified and corrected"},{"criterion":"Serving recovery","points":10,"observableEvidence":"Known-good immutable revision routed and independently verified"},{"criterion":"Prevention","points":10,"observableEvidence":"Idempotency terminal validation promotion handshake tests and alerts"}],"maximumScore":50}
