{"schemaVersion":1,"kind":"assessment","lessonId":"LES-0052","masteryBoundary":"requires-reviewed-learner-evidence","lastReviewed":"2026-08-04","reviewAfter":"2027-02-04","id":"ASM-0141","type":"independent-transfer","difficulty":"expert","prompt":"Unseen hybrid network: trace and repair DNS, overlap, route, policy, translation, return, NAT, MTU and non-transitive peering failures; translate the design to AWS, Azure and Google Cloud without creating resources.","deliverables":["Flow inventory and forward/return path diagrams.","Enterprise IPv4/IPv6 address plan with growth and overlap controls.","Route domains, effective route selection and BGP policy.","Stateful/stateless policy and translated-tuple map.","DNS authority/forwarding/private endpoint design.","Peering versus transit decision and three-provider scope translation.","Redundant VPN/dedicated hybrid design with MTU/failover.","NAT/load-balancer/appliance capacity and observability plan.","Incident recovery, user validation and rollback.","Cost/risk/migration record and exact local cleanup."],"evidenceRequirements":["Reviewer supplies unseen topology and changes one route/DNS/failure requirement.","Synthetic local prefixes only; no corporate network, provider account, credential or public listener.","Evidence binds exact tuples, answers, prefixes, selected routes, policy, translations and timestamps.","One rejected broad-firewall fix and one rejected topology are preserved.","Three-provider mappings cite current primary sources and explicit scope differences.","Reviewer observes changed-case reasoning, delayed recall, user-like recovery and cleanup."],"reviewPolicy":"reviewer-only-no-model-answer","rubric":[{"criterion":"Flow/path","points":10,"observableEvidence":"Flow/path"},{"criterion":"IPAM","points":10,"observableEvidence":"IPAM"},{"criterion":"Routing/BGP","points":10,"observableEvidence":"Routing/BGP"},{"criterion":"Policy/NAT","points":10,"observableEvidence":"Policy/NAT"},{"criterion":"DNS/endpoints","points":10,"observableEvidence":"DNS/endpoints"},{"criterion":"Topology/provider","points":10,"observableEvidence":"Topology/provider"},{"criterion":"Hybrid/MTU","points":10,"observableEvidence":"Hybrid/MTU"},{"criterion":"Capacity/observability","points":10,"observableEvidence":"Capacity/observability"},{"criterion":"Recovery","points":10,"observableEvidence":"Recovery"},{"criterion":"Cost/cleanup","points":10,"observableEvidence":"Cost/cleanup"}],"maximumScore":100}
